{
  "$schema": "http://json-schema.org/draft-07/schema#",
  "$id": "photo-upload-v1",
  "title": "PhotoUploadV1",
  "description": "Metadata sent alongside the JPEG preview when uploading a photo from the LR plugin.",
  "type": "object",
  "required": ["schema_version", "lr_catalog_uuid"],
  "additionalProperties": false,
  "properties": {
    "schema_version": {
      "type": "string",
      "enum": ["photo-upload-v1"]
    },
    "lr_catalog_uuid": {
      "type": "string",
      "description": "Lightroom Classic catalog UUID — stable identifier assigned by LR."
    },
    "exif_snapshot": {
      "type": "object",
      "description": "EXIF metadata snapshot (camera model, ISO, shutter speed, aperture, focal length, etc.).",
      "additionalProperties": true
    },
    "lr_develop_settings": {
      "type": "object",
      "description": "Current Lightroom Develop module settings at time of export (baseline for delta calculation).",
      "additionalProperties": true
    }
  }
}
